{
  "$schema": "https://json-schema.org/draft/2020-12/schema",
  "title": "Witness Examination Blueprint v2.90",
  "type": "object",
  "properties": {
    "schemaVersion": {
      "type": "string"
    },
    "mode": {
      "type": "string"
    },
    "caseContext": {
      "type": "string"
    },
    "keyFact": {
      "type": "string"
    },
    "documents": {
      "type": "array"
    },
    "witness": {
      "type": "object",
      "properties": {
        "typeId": {
          "type": "string"
        },
        "label": {
          "type": "string"
        },
        "role": {
          "type": "string"
        }
      }
    },
    "judge": {
      "type": "object",
      "properties": {
        "typeId": {
          "type": "string"
        },
        "label": {
          "type": "string"
        }
      }
    },
    "stages": {
      "type": "array"
    },
    "finalTemplates": {
      "type": "object"
    },
    "warnings": {
      "type": "array"
    }
  },
  "additionalProperties": true
}
