{
  "schemaVersion": "2.90",
  "mode": "trener",
  "caseContext": "Przykładowa sprawa pracownicza.",
  "keyFact": "Czy świadek widział przebieg rozmowy dyscyplinującej.",
  "documents": [
    "notatka służbowa",
    "korespondencja e-mail"
  ],
  "witness": {
    "typeId": "emotional",
    "label": "Świadek A",
    "role": "pracownik"
  },
  "judge": {
    "typeId": "formalist",
    "label": "Sąd pracy"
  },
  "stages": [
    {
      "id": "stage-1",
      "title": "Ustalenie obecności",
      "goal": "bezpośredniość wiedzy",
      "questions": [
        "Czy był/a Pan/Pani obecny/a przy rozmowie?",
        "Gdzie Pan/Pani się znajdował/a?"
      ]
    },
    {
      "id": "stage-2",
      "title": "Treść zdarzenia",
      "goal": "ustalenie faktów",
      "questions": [
        "Jakie słowa padły?",
        "Kto jeszcze był obecny?"
      ]
    }
  ],
  "finalTemplates": {
    "courtReadyQuestions": [
      "Czy był/a Pan/Pani bezpośrednim świadkiem rozmowy?"
    ],
    "closingNotes": [
      "Porównać odpowiedzi z dokumentami."
    ],
    "doNotAsk": [
      "Nie zadawać pytań obraźliwych."
    ]
  },
  "warnings": [
    "Przy świadku emocjonalnym i sędzi formalistycznym ograniczyć narrację."
  ]
}
